{
  "schemaVersion": "1.0",
  "sessionId": "molecular-extraction-qc",
  "sessionTitle": "Nucleic acid extraction and cleanup",
  "packetStatus": "complete",
  "startedAt": "2026-08-01T19:23:53Z",
  "writtenAt": "2026-08-01T19:28:12Z",
  "worker": "crawler-molecular-extraction-qc-2026-08-01",
  "sourcesSearched": [
    "https://www.protocols.io/",
    "https://www.fda.gov/food/laboratory-methods-food/bam",
    "https://www.neb.com/protocols/",
    "https://www.qiagen.com/",
    "https://www.thermofisher.com/",
    "https://www.zymo-research.com/"
  ],
  "categoryResults": [
    {
      "categoryId": "dna-extraction",
      "categoryLabel": "Genomic DNA extraction",
      "status": "complete",
      "searchedAt": "2026-08-01",
      "sourcesSearched": [
        "https://www.protocols.io/",
        "https://www.fda.gov/food/laboratory-methods-food/bam",
        "https://www.qiagen.com/"
      ],
      "representative": {
        "title": "Manual DNA Extraction using Qiagen DNeasy Blood and Tissue Kit",
        "protocolType": "Genomic DNA extraction protocol",
        "assay": "Sample lysis and DNA purification",
        "operation": "Genomic DNA isolation",
        "source": "FDA GenomeTrakr / protocols.io",
        "sourceUrl": "https://dx.doi.org/10.17504/protocols.io.bi4dkgs6",
        "sourceRecordId": "bi4dkgs6",
        "doi": "10.17504/protocols.io.bi4dkgs6",
        "authors": [
          "Alyssa E. Bird",
          "Marilyn L. H. Wong",
          "Catherine H. C. Chen",
          "Sarah E. Allard"
        ],
        "published": "2020-08-14",
        "updated": "2021-11-10",
        "licenseCode": "CC BY 4.0",
        "licenseUrl": "https://creativecommons.org/licenses/by/4.0/",
        "licenseEvidenceUrl": "https://dx.doi.org/10.17504/protocols.io.bi4dkgs6",
        "licenseVerifiedAt": "2026-08-01T19:26:00Z",
        "metadataVerifiedAt": "2026-08-01T19:26:00Z",
        "specimen": "Bacterial cells",
        "organism": null,
        "platform": "Qiagen DNeasy Blood and Tissue silica spin column",
        "methodVariant": "Manual silica spin-column genomic DNA extraction for bacterial-cell samples",
        "safetyLevel": "not specified",
        "confidence": 0.91,
        "scoreBreakdown": {
          "recordSpecificity": 0.96,
          "sourceAuthority": 0.93,
          "metadataCompleteness": 0.91,
          "freshness": 0.79,
          "corroboration": 0.82,
          "overall": 0.89
        },
        "evidenceStatus": "metadata-and-license-verified",
        "selectionNote": "Selected as a uniquely identified, authoritative genomic-DNA record with explicit specimen scope, kit chemistry, authorship, dates, and record-level license evidence. The bacterial-cell scope is retained as a named method variant rather than generalized to tissue or plant DNA."
      },
      "screened": [
        {
          "title": "DNA Extraction from Fungi using DNeasy PowerSoil Pro Kit",
          "source": "protocols.io",
          "sourceUrl": "https://dx.doi.org/10.17504/protocols.io.jxxcppn",
          "sourceRecordId": "jxxcppn",
          "doi": "10.17504/protocols.io.jxxcppn",
          "screenStatus": "wrong-variant",
          "reason": "Fungal and soil-specific extraction chemistry; useful variant coverage but not the best generic bacterial genomic-DNA representative."
        },
        {
          "title": "DNA Extraction from Buccal Swabs",
          "source": "protocols.io",
          "sourceUrl": "https://dx.doi.org/10.17504/protocols.io.ewov1p4",
          "sourceRecordId": "ewov1p4",
          "doi": "10.17504/protocols.io.ewov1p4",
          "screenStatus": "wrong-variant",
          "reason": "Human buccal-swab specimen and collection-specific workflow; does not represent the assigned bacterial/tissue genomic-DNA scope."
        }
      ],
      "coverageGaps": [
        "The representative is a bacterial-cell silica-column variant; plant, mammalian tissue, blood, and magnetic-bead genomic-DNA workflows remain distinct subvariants.",
        "Suggested child category: plant genomic-DNA extraction.",
        "Suggested child category: mammalian tissue or blood genomic-DNA extraction."
      ],
      "nextSearchSuggestions": [
        "Screen plant CTAB genomic-DNA protocols as a separate chemistry and specimen variant.",
        "Screen magnetic-bead genomic-DNA extraction for blood or tissue as a separate technology variant."
      ]
    },
    {
      "categoryId": "rna-extraction",
      "categoryLabel": "Total RNA extraction",
      "status": "complete",
      "searchedAt": "2026-08-01",
      "sourcesSearched": [
        "https://www.protocols.io/",
        "https://www.neb.com/protocols/",
        "https://www.zymo-research.com/"
      ],
      "representative": {
        "title": "Quick Protocol for Monarch Total RNA Miniprep Kit (NEB #T2010)",
        "protocolType": "Total RNA extraction protocol",
        "assay": "RNA purification and sample preparation",
        "operation": "Total RNA isolation",
        "source": "New England Biolabs / protocols.io",
        "sourceUrl": "https://dx.doi.org/10.17504/protocols.io.bg9njz5e",
        "sourceRecordId": "bg9njz5e",
        "doi": "10.17504/protocols.io.bg9njz5e",
        "authors": [
          "New England Biolabs",
          "Isabel Gautreau"
        ],
        "published": "2020-06-07",
        "updated": "2022-02-20",
        "licenseCode": "CC BY 4.0",
        "licenseUrl": "https://creativecommons.org/licenses/by/4.0/",
        "licenseEvidenceUrl": "https://dx.doi.org/10.17504/protocols.io.bg9njz5e",
        "licenseVerifiedAt": "2026-08-01T19:26:00Z",
        "metadataVerifiedAt": "2026-08-01T19:26:00Z",
        "specimen": "Cultured cells, tissue, or blood samples",
        "organism": null,
        "platform": "Monarch Total RNA Miniprep Kit, NEB T2010",
        "methodVariant": "Silica spin-column total-RNA miniprep with sample-type-specific input variants",
        "safetyLevel": "not specified",
        "confidence": 0.9,
        "scoreBreakdown": {
          "recordSpecificity": 0.95,
          "sourceAuthority": 0.95,
          "metadataCompleteness": 0.9,
          "freshness": 0.84,
          "corroboration": 0.84,
          "overall": 0.9
        },
        "evidenceStatus": "metadata-and-license-verified",
        "selectionNote": "Selected because it is a uniquely identified NEB total-RNA record with explicit kit identity, sample-type coverage, named contributors, version dates, and record-level license evidence. Small-RNA enrichment and plant or phenol-based workflows remain separate variants."
      },
      "screened": [
        {
          "title": "Total RNA Isolation from Bulk Tissue or Isolated Cells",
          "source": "protocols.io",
          "sourceUrl": "https://dx.doi.org/10.17504/protocols.io.8dehs3e",
          "sourceRecordId": "8dehs3e",
          "doi": "10.17504/protocols.io.8dehs3e",
          "screenStatus": "alternative",
          "reason": "Strong broad tissue-and-cell alternative, retained for coverage, but less kit-specific than the selected NEB record."
        },
        {
          "title": "Total RNA Extraction from Adherent Mammalian Cancer Cells using Zymo Quick-RNA Miniprep Kit",
          "source": "protocols.io",
          "sourceUrl": "https://dx.doi.org/10.17504/protocols.io.e6nvwqxq7vmk",
          "sourceRecordId": "e6nvwqxq7vmk",
          "doi": "10.17504/protocols.io.e6nvwqxq7vmk",
          "screenStatus": "alternative",
          "reason": "Recent, specific mammalian-cell workflow, but narrower specimen scope than the selected multi-input total-RNA record."
        }
      ],
      "coverageGaps": [
        "Plant total-RNA extraction and phenol/guanidinium workflows are not represented by the selected silica-column record.",
        "Suggested child category: plant total-RNA extraction.",
        "Suggested child category: phenol-based total-RNA extraction.",
        "Small-RNA enrichment is intentionally tracked in the separate small-rna-extraction category."
      ],
      "nextSearchSuggestions": [
        "Add a plant CTAB or guanidinium-based total-RNA record if plant workflows become a required child category.",
        "Add a phenol-based total-RNA record if chemistry-specific comparison is required."
      ]
    },
    {
      "categoryId": "small-rna-extraction",
      "categoryLabel": "Small RNA enrichment",
      "status": "complete",
      "searchedAt": "2026-08-01",
      "sourcesSearched": [
        "https://www.protocols.io/",
        "https://www.neb.com/protocols/",
        "https://www.qiagen.com/"
      ],
      "representative": {
        "title": "Drosophila Small RNA Isolation",
        "protocolType": "Small RNA enrichment protocol",
        "assay": "Small RNA preparation",
        "operation": "Size-selected small RNA isolation",
        "source": "protocols.io",
        "sourceUrl": "https://dx.doi.org/10.17504/protocols.io.yxmvm2xpog3p/v1",
        "sourceRecordId": "yxmvm2xpog3p",
        "doi": "10.17504/protocols.io.yxmvm2xpog3p",
        "authors": [
          "Anton Enright",
          "Alistair Davis",
          "Sarah Moxon",
          "Daniel Lobb",
          "Karin Straub"
        ],
        "published": "2022-10-14",
        "updated": "2022-10-14",
        "licenseCode": "CC BY 4.0",
        "licenseUrl": "https://creativecommons.org/licenses/by/4.0/",
        "licenseEvidenceUrl": "https://dx.doi.org/10.17504/protocols.io.yxmvm2xpog3p/v1",
        "licenseVerifiedAt": "2026-08-01T19:26:00Z",
        "metadataVerifiedAt": "2026-08-01T19:26:00Z",
        "specimen": "Drosophila melanogaster material",
        "organism": "Drosophila melanogaster",
        "platform": "Urea-PAGE and gel-size selection",
        "methodVariant": "Gel-based isolation of size-selected small RNAs, including miRNA-scale products",
        "safetyLevel": "not specified",
        "confidence": 0.86,
        "scoreBreakdown": {